{"authority_id":"gpumd-release-source-docs-5-3","blockers":[],"contract_name":"official-source-license-review","corpus_ref":{"corpus_id":"gpumd-rigorous-simulations-gpumd-docs-official-corpus","sha256":"ab12ca0026926614c58fcb8fca7424670b0ef3de2659de628232e1c73b685db6"},"evidence":[{"evidence_id":"gpumd-docs-license-evidence","hash_basis":"unattested-external-locator","locator":"https://raw.githubusercontent.com/brucefan1983/GPUMD/f2b46c5d528e985a5bf68becd442b18c0e04396c/LICENCE","revision":null,"sha256":null,"terms_content_ref":null}],"license_identity":{"identifier":"GPL-3.0-or-later","terms_urls":["https://raw.githubusercontent.com/brucefan1983/GPUMD/f2b46c5d528e985a5bf68becd442b18c0e04396c/LICENCE"],"verification":"verified"},"license_review_id":"gpumd-rigorous-simulations-gpumd-docs-license-review","limitations":["License trust remains unverified in the central consumer registry.","The exact official-terms bytes and retrieval revision are not locally bound or platform attested.","The generated review is the conservative intersection of the central authority policy and the hashed provider catalog.","The source license does not establish redistribution rights for example datasets, potential/model files, trained weights, GPU runtimes, or third-party dependencies."],"producer":{"generated_utc":"2026-07-23T20:17:38Z","skill_id":"gpumd-rigorous-simulations","skill_version":"1.0","tool_id":"official-document-pack-builder","tool_version":"1.0"},"review_expires_utc":null,"reviewer":{"reviewed_utc":"2026-07-23T20:17:38Z","reviewer_id":"official-document-pack-builder","role":"license-reviewer"},"schema_version":"1.0","status":"partial","storage_rules":[{"allowed_storage_modes":["external-runtime-only","metadata-only"],"artifact_kind":"metadata","assessment":"conditional","attribution_required":"unknown","conditions":["Keep official body content external; retain only exact identities, selectors, and receipts in this pack."],"license_evidence_refs":["gpumd-docs-license-evidence"],"limitations":["The exact official-terms bytes, retrieval revision, reviewer, and obligation analysis are not platform attested.","The generated review is the conservative intersection of the central authority policy and the hashed provider catalog.","The source license does not establish redistribution rights for example datasets, potential/model files, trained weights, GPU runtimes, or third-party dependencies."],"modified_content_marking_required":"unknown","notice_required":"unknown","rights_holder":"Official provider; exact rights-holder scope remains subject to the cited official terms.","share_alike_required":"unknown","source_material_class":"documentation-text","source_offer_required":"unknown"}],"supersedes_review_ids":[],"trust_attestation":{"attestation_ref":null,"registry_path":"registry/official-document-consumers.yaml","registry_sha256":"60bf8d0f3d9596eeac1d9541d5f819d549ac937ab5a6fa5c316f6413d939a99c","trust_id":null,"trust_mode":"unverified"}}
