{"authority_id":"siesta-official-docs","blockers":[],"contract_name":"official-source-license-review","corpus_ref":{"corpus_id":"siesta-rigorous-calculations-siesta-portal-official-corpus","sha256":"2e1cf2aad06ce1c07f0d0557bccb19e95b5f4509e415e9a93fce540355f546be"},"evidence":[{"evidence_id":"siesta-portal-license-evidence","hash_basis":"unattested-external-locator","locator":"https://gitlab.com/siesta-project/documentation/siesta-docs/-/raw/ca6da4c46538bccce34776cdbb075fa4bfc2c6dc/LICENSE","revision":null,"sha256":null,"terms_content_ref":null}],"license_identity":{"identifier":"CC-BY-NC-SA-4.0","terms_urls":["https://gitlab.com/siesta-project/documentation/siesta-docs/-/raw/ca6da4c46538bccce34776cdbb075fa4bfc2c6dc/LICENSE"],"verification":"verified"},"license_review_id":"siesta-rigorous-calculations-siesta-portal-license-review","limitations":["License trust remains unverified in the central consumer registry.","The exact official-terms bytes and retrieval revision are not locally bound or platform attested.","The generated review is the conservative intersection of the central authority policy and the hashed provider catalog.","The non-commercial share-alike documentation license and central authority policy prohibit embedding portal bodies."],"producer":{"generated_utc":"2026-07-23T19:30:41Z","skill_id":"siesta-rigorous-calculations","skill_version":"1.0","tool_id":"official-document-pack-builder","tool_version":"1.0"},"review_expires_utc":null,"reviewer":{"reviewed_utc":"2026-07-23T19:30:41Z","reviewer_id":"official-document-pack-builder","role":"license-reviewer"},"schema_version":"1.0","status":"partial","storage_rules":[{"allowed_storage_modes":["excluded","external-runtime-only","metadata-only"],"artifact_kind":"metadata","assessment":"conditional","attribution_required":"unknown","conditions":["Keep official body content external; retain only exact identities, selectors, and receipts in this pack."],"license_evidence_refs":["siesta-portal-license-evidence"],"limitations":["The exact official-terms bytes, retrieval revision, reviewer, and obligation analysis are not platform attested.","The generated review is the conservative intersection of the central authority policy and the hashed provider catalog.","The non-commercial share-alike documentation license and central authority policy prohibit embedding portal bodies."],"modified_content_marking_required":"unknown","notice_required":"unknown","rights_holder":"Official provider; exact rights-holder scope remains subject to the cited official terms.","share_alike_required":"unknown","source_material_class":"documentation-text","source_offer_required":"unknown"}],"supersedes_review_ids":[],"trust_attestation":{"attestation_ref":null,"registry_path":"registry/official-document-consumers.yaml","registry_sha256":"60bf8d0f3d9596eeac1d9541d5f819d549ac937ab5a6fa5c316f6413d939a99c","trust_id":null,"trust_mode":"unverified"}}
