{"authority_id":"iucr-comcifs-cif-standards","blockers":[],"contract_name":"official-source-license-review","corpus_ref":{"corpus_id":"cif-structure-analysis-iucr-cif-standards-official-corpus","sha256":"9c50b335ff6d90bfc652fdc95d884872ebd30c5bf9bb7e8d1bbfec59591f93e7"},"evidence":[{"evidence_id":"iucr-cif-standards-license-evidence","hash_basis":"unattested-external-locator","locator":"https://www.iucr.org/resources/cif","revision":null,"sha256":null,"terms_content_ref":null}],"license_identity":{"identifier":null,"terms_urls":[],"verification":"unknown"},"license_review_id":"cif-structure-analysis-iucr-cif-standards-license-review","limitations":["License trust remains unverified in the central consumer registry.","Only metadata and external receipts are stored; official source text is not embedded.","The exact official-terms bytes and retrieval revision are not locally bound or platform attested.","The generated review is the conservative intersection of the central authority policy and the hashed provider catalog.","Unverified catalog license identifier and terms URL claims were conservatively downgraded to null/empty; the separately declared official_terms_locator remains evidence only."],"producer":{"generated_utc":"2026-07-24T00:00:00Z","skill_id":"cif-structure-analysis","skill_version":"1.0","tool_id":"official-document-pack-builder","tool_version":"1.0"},"review_expires_utc":null,"reviewer":{"reviewed_utc":"2026-07-24T00:00:00Z","reviewer_id":"official-document-pack-builder","role":"license-reviewer"},"schema_version":"1.0","status":"partial","storage_rules":[{"allowed_storage_modes":["external-runtime-only","metadata-only"],"artifact_kind":"metadata","assessment":"unresolved","attribution_required":"unknown","conditions":["Keep official body content external; retain only exact identities, selectors, and receipts in this pack."],"license_evidence_refs":["iucr-cif-standards-license-evidence"],"limitations":["Only metadata and external receipts are stored; official source text is not embedded.","The exact official-terms bytes, retrieval revision, reviewer, and obligation analysis are not platform attested.","The generated review is the conservative intersection of the central authority policy and the hashed provider catalog.","Unverified catalog license identifier and terms URL claims were conservatively downgraded to null/empty; the separately declared official_terms_locator remains evidence only."],"modified_content_marking_required":"unknown","notice_required":"unknown","rights_holder":"Official provider; exact rights-holder scope remains subject to the cited official terms.","share_alike_required":"unknown","source_material_class":"documentation-text","source_offer_required":"unknown"}],"supersedes_review_ids":[],"trust_attestation":{"attestation_ref":null,"registry_path":"registry/official-document-consumers.yaml","registry_sha256":"60bf8d0f3d9596eeac1d9541d5f819d549ac937ab5a6fa5c316f6413d939a99c","trust_id":null,"trust_mode":"unverified"}}
