{"authority_id":"fairchem-dataset-reference-docs","blockers":[],"contract_name":"official-source-license-review","corpus_ref":{"corpus_id":"ml-potential-workflows-fairchem-datasets-official-corpus","sha256":"f2e8b61fa36f10a98ca913bce26e3be40d78e8a9445d1f183dae8b711f1dfc18"},"evidence":[{"evidence_id":"fairchem-datasets-license-evidence","hash_basis":"unattested-external-locator","locator":"https://github.com/FAIR-Chem/fairchem/blob/f47a0a6f0f594ea051b70091304864242df933e1/LICENSE.md","revision":null,"sha256":null,"terms_content_ref":null}],"license_identity":{"identifier":"MIT","terms_urls":["https://github.com/FAIR-Chem/fairchem/blob/f47a0a6f0f594ea051b70091304864242df933e1/LICENSE.md"],"verification":"verified"},"license_review_id":"ml-potential-workflows-fairchem-datasets-license-review","limitations":["License trust remains unverified in the central consumer registry.","The documented CC-BY-4.0 dataset statements, external dataset bytes, provider software and reference-DFT artifacts remain separate rights layers.","The exact official-terms bytes and retrieval revision are not locally bound or platform attested.","The generated review is the conservative intersection of the central authority policy and the hashed provider catalog.","This license assessment covers the exact repository documentation source only."],"producer":{"generated_utc":"2026-07-23T19:35:04Z","skill_id":"ml-potential-workflows","skill_version":"1.0","tool_id":"official-document-pack-builder","tool_version":"1.0"},"review_expires_utc":null,"reviewer":{"reviewed_utc":"2026-07-23T19:35:04Z","reviewer_id":"official-document-pack-builder","role":"license-reviewer"},"schema_version":"1.0","status":"partial","storage_rules":[{"allowed_storage_modes":["metadata-only"],"artifact_kind":"metadata","assessment":"allowed","attribution_required":"unknown","conditions":["Keep official body content external; retain only exact identities, selectors, and receipts in this pack."],"license_evidence_refs":["fairchem-datasets-license-evidence"],"limitations":["The documented CC-BY-4.0 dataset statements, external dataset bytes, provider software and reference-DFT artifacts remain separate rights layers.","The exact official-terms bytes, retrieval revision, reviewer, and obligation analysis are not platform attested.","The generated review is the conservative intersection of the central authority policy and the hashed provider catalog.","This license assessment covers the exact repository documentation source only."],"modified_content_marking_required":"unknown","notice_required":"unknown","rights_holder":"Official provider; exact rights-holder scope remains subject to the cited official terms.","share_alike_required":"unknown","source_material_class":"documentation-text","source_offer_required":"unknown"}],"supersedes_review_ids":[],"trust_attestation":{"attestation_ref":null,"registry_path":"registry/official-document-consumers.yaml","registry_sha256":"60bf8d0f3d9596eeac1d9541d5f819d549ac937ab5a6fa5c316f6413d939a99c","trust_id":null,"trust_mode":"unverified"}}
