{"authority_id":"cp2k-official-manual","blockers":[],"contract_name":"official-source-license-review","corpus_ref":{"corpus_id":"cp2k-rigorous-calculations-cp2k-manual-official-corpus","sha256":"a62df6ac48dcf3d24001fd3f8e30ac17a0a7f55e8db916a597e9a38cd00183dc"},"evidence":[{"evidence_id":"cp2k-manual-license-evidence","hash_basis":"unattested-external-locator","locator":"https://raw.githubusercontent.com/cp2k/cp2k/67b5da876dd6a76b8b021d5a04d1c81ba79a4c50/LICENSE","revision":null,"sha256":null,"terms_content_ref":null}],"license_identity":{"identifier":null,"terms_urls":[],"verification":"unknown"},"license_review_id":"cp2k-rigorous-calculations-cp2k-manual-license-review","limitations":["License trust remains unverified in the central consumer registry.","The central CP2K manual authority has no verified documentation-license identity; no document body is stored.","The exact official-terms bytes and retrieval revision are not locally bound or platform attested.","The generated review is the conservative intersection of the central authority policy and the hashed provider catalog."],"producer":{"generated_utc":"2026-07-23T19:30:41Z","skill_id":"cp2k-rigorous-calculations","skill_version":"1.0","tool_id":"official-document-pack-builder","tool_version":"1.0"},"review_expires_utc":null,"reviewer":{"reviewed_utc":"2026-07-23T19:30:41Z","reviewer_id":"official-document-pack-builder","role":"license-reviewer"},"schema_version":"1.0","status":"partial","storage_rules":[{"allowed_storage_modes":["external-runtime-only","metadata-only"],"artifact_kind":"metadata","assessment":"unresolved","attribution_required":"unknown","conditions":["Keep official body content external; retain only exact identities, selectors, and receipts in this pack."],"license_evidence_refs":["cp2k-manual-license-evidence"],"limitations":["The central CP2K manual authority has no verified documentation-license identity; no document body is stored.","The exact official-terms bytes, retrieval revision, reviewer, and obligation analysis are not platform attested.","The generated review is the conservative intersection of the central authority policy and the hashed provider catalog."],"modified_content_marking_required":"unknown","notice_required":"unknown","rights_holder":"Official provider; exact rights-holder scope remains subject to the cited official terms.","share_alike_required":"unknown","source_material_class":"documentation-text","source_offer_required":"unknown"}],"supersedes_review_ids":[],"trust_attestation":{"attestation_ref":null,"registry_path":"registry/official-document-consumers.yaml","registry_sha256":"60bf8d0f3d9596eeac1d9541d5f819d549ac937ab5a6fa5c316f6413d939a99c","trust_id":null,"trust_mode":"unverified"}}
