{"authority_id":"siesta-release-source-docs","blockers":[],"contract_name":"official-source-license-review","corpus_ref":{"corpus_id":"siesta-rigorous-calculations-siesta-release-official-corpus","sha256":"a03c761e6d4fa0e5e89b15bee1017d3460cddda89fb9315c8f20a0d2fd7c909c"},"evidence":[{"evidence_id":"siesta-release-license-evidence","hash_basis":"unattested-external-locator","locator":"https://gitlab.com/siesta-project/siesta/-/raw/e486d12067b96ff688179f0496d0ec21b6fae0ab/COPYING","revision":null,"sha256":null,"terms_content_ref":null}],"license_identity":{"identifier":"GPL-3.0-only","terms_urls":["https://gitlab.com/siesta-project/siesta/-/raw/e486d12067b96ff688179f0496d0ec21b6fae0ab/COPYING"],"verification":"verified"},"license_review_id":"siesta-rigorous-calculations-siesta-release-license-review","limitations":["License trust remains unverified in the central consumer registry.","The exact official-terms bytes and retrieval revision are not locally bound or platform attested.","The generated review is the conservative intersection of the central authority policy and the hashed provider catalog.","The repository policy forbids embedded bundle content even though the exact release source license is known-open."],"producer":{"generated_utc":"2026-07-23T19:30:41Z","skill_id":"siesta-rigorous-calculations","skill_version":"1.0","tool_id":"official-document-pack-builder","tool_version":"1.0"},"review_expires_utc":null,"reviewer":{"reviewed_utc":"2026-07-23T19:30:41Z","reviewer_id":"official-document-pack-builder","role":"license-reviewer"},"schema_version":"1.0","status":"partial","storage_rules":[{"allowed_storage_modes":["external-runtime-only","metadata-only"],"artifact_kind":"metadata","assessment":"allowed","attribution_required":"unknown","conditions":["Keep official body content external; retain only exact identities, selectors, and receipts in this pack."],"license_evidence_refs":["siesta-release-license-evidence"],"limitations":["The exact official-terms bytes, retrieval revision, reviewer, and obligation analysis are not platform attested.","The generated review is the conservative intersection of the central authority policy and the hashed provider catalog.","The repository policy forbids embedded bundle content even though the exact release source license is known-open."],"modified_content_marking_required":"unknown","notice_required":"unknown","rights_holder":"Official provider; exact rights-holder scope remains subject to the cited official terms.","share_alike_required":"unknown","source_material_class":"documentation-text","source_offer_required":"unknown"}],"supersedes_review_ids":[],"trust_attestation":{"attestation_ref":null,"registry_path":"registry/official-document-consumers.yaml","registry_sha256":"60bf8d0f3d9596eeac1d9541d5f819d549ac937ab5a6fa5c316f6413d939a99c","trust_id":null,"trust_mode":"unverified"}}
