{"authority_id":"spglib-release-source-docs-2-7-0","blockers":[],"contract_name":"official-source-license-review","corpus_ref":{"corpus_id":"dft-structure-preparation-spglib-docs-official-corpus","sha256":"3197bb340938d6e885fbf9fac0bb79c549781662e172ff597416e41f4eb40f52"},"evidence":[{"evidence_id":"spglib-docs-license-evidence","hash_basis":"unattested-external-locator","locator":"https://raw.githubusercontent.com/spglib/spglib/v2.7.0/COPYING","revision":null,"sha256":null,"terms_content_ref":null}],"license_identity":{"identifier":"BSD-3-Clause","terms_urls":["https://raw.githubusercontent.com/spglib/spglib/v2.7.0/COPYING"],"verification":"verified"},"license_review_id":"dft-structure-preparation-spglib-docs-license-review","limitations":["License trust remains unverified in the central consumer registry.","The exact official-terms bytes and retrieval revision are not locally bound or platform attested.","The generated review is the conservative intersection of the central authority policy and the hashed provider catalog.","The repository license notice is verified for the exact source tree, but documentation-specific generated assets and third-party components still require review before body storage."],"producer":{"generated_utc":"2026-07-23T20:17:38Z","skill_id":"dft-structure-preparation","skill_version":"1.0","tool_id":"official-document-pack-builder","tool_version":"1.0"},"review_expires_utc":null,"reviewer":{"reviewed_utc":"2026-07-23T20:17:38Z","reviewer_id":"official-document-pack-builder","role":"license-reviewer"},"schema_version":"1.0","status":"partial","storage_rules":[{"allowed_storage_modes":["external-runtime-only","metadata-only"],"artifact_kind":"metadata","assessment":"conditional","attribution_required":"unknown","conditions":["Keep official body content external; retain only exact identities, selectors, and receipts in this pack."],"license_evidence_refs":["spglib-docs-license-evidence"],"limitations":["The exact official-terms bytes, retrieval revision, reviewer, and obligation analysis are not platform attested.","The generated review is the conservative intersection of the central authority policy and the hashed provider catalog.","The repository license notice is verified for the exact source tree, but documentation-specific generated assets and third-party components still require review before body storage."],"modified_content_marking_required":"unknown","notice_required":"unknown","rights_holder":"Official provider; exact rights-holder scope remains subject to the cited official terms.","share_alike_required":"unknown","source_material_class":"documentation-text","source_offer_required":"unknown"}],"supersedes_review_ids":[],"trust_attestation":{"attestation_ref":null,"registry_path":"registry/official-document-consumers.yaml","registry_sha256":"60bf8d0f3d9596eeac1d9541d5f819d549ac937ab5a6fa5c316f6413d939a99c","trust_id":null,"trust_mode":"unverified"}}
