{"authority_id":"ovito-pypi-release-metadata-3-15-5","blockers":[],"contract_name":"official-source-license-review","corpus_ref":{"corpus_id":"ovito-atomistic-analysis-ovito-pypi-official-corpus","sha256":"be7732bae161f183d4af102e338af0401a0356ee8317e4a01ebc80fab89f2861"},"evidence":[{"evidence_id":"ovito-pypi-license-evidence","hash_basis":"unattested-external-locator","locator":"https://pypi.org/project/ovito/3.15.5/","revision":null,"sha256":null,"terms_content_ref":null}],"license_identity":{"identifier":"MIT","terms_urls":["https://pypi.org/project/ovito/3.15.5/","https://gitlab.com/stuko/ovito/-/raw/0b2cdccef7452bf28212e15daf9df2dc7a545bcc/LICENSE.MIT.txt"],"verification":"verified"},"license_review_id":"ovito-atomistic-analysis-ovito-pypi-license-review","limitations":["License trust remains unverified in the central consumer registry.","The PyPI license expression does not replace component notices, third-party terms, proprietary Pro desktop/entitlement terms, or user-data/artifact rights.","The exact official-terms bytes and retrieval revision are not locally bound or platform attested.","The generated review is the conservative intersection of the central authority policy and the hashed provider catalog."],"producer":{"generated_utc":"2026-07-24T00:00:00Z","skill_id":"ovito-atomistic-analysis","skill_version":"1.0","tool_id":"official-document-pack-builder","tool_version":"1.0"},"review_expires_utc":null,"reviewer":{"reviewed_utc":"2026-07-24T00:00:00Z","reviewer_id":"official-document-pack-builder","role":"license-reviewer"},"schema_version":"1.0","status":"partial","storage_rules":[{"allowed_storage_modes":["external-runtime-only","metadata-only"],"artifact_kind":"metadata","assessment":"conditional","attribution_required":"unknown","conditions":["Keep official body content external; retain only exact identities, selectors, and receipts in this pack."],"license_evidence_refs":["ovito-pypi-license-evidence"],"limitations":["The PyPI license expression does not replace component notices, third-party terms, proprietary Pro desktop/entitlement terms, or user-data/artifact rights.","The exact official-terms bytes, retrieval revision, reviewer, and obligation analysis are not platform attested.","The generated review is the conservative intersection of the central authority policy and the hashed provider catalog."],"modified_content_marking_required":"unknown","notice_required":"unknown","rights_holder":"Official provider; exact rights-holder scope remains subject to the cited official terms.","share_alike_required":"unknown","source_material_class":"documentation-text","source_offer_required":"unknown"}],"supersedes_review_ids":[],"trust_attestation":{"attestation_ref":null,"registry_path":"registry/official-document-consumers.yaml","registry_sha256":"60bf8d0f3d9596eeac1d9541d5f819d549ac937ab5a6fa5c316f6413d939a99c","trust_id":null,"trust_mode":"unverified"}}
