{"authority_id":"vibe-dft-skills-repository-contracts","blockers":[],"contract_name":"official-source-license-review","corpus_ref":{"corpus_id":"dft-project-orchestrator-repository-contracts-orchestrator-official-corpus","sha256":"4de25186d34fcbc621f788bea9f0faa755783a135dd9de3328f59224c6cbe25e"},"evidence":[{"evidence_id":"repository-contracts-orchestrator-license-evidence","hash_basis":"unattested-external-locator","locator":"https://github.com/Maxwell3919/Vibe-DFT-Skills","revision":null,"sha256":null,"terms_content_ref":null}],"license_identity":{"identifier":null,"terms_urls":[],"verification":"unknown"},"license_review_id":"dft-project-orchestrator-repository-contracts-orchestrator-license-review","limitations":["License trust remains unverified in the central consumer registry.","No root repository license was found; exact revision identity does not grant redistribution rights.","The exact official-terms bytes and retrieval revision are not locally bound or platform attested.","The generated review is the conservative intersection of the central authority policy and the hashed provider catalog."],"producer":{"generated_utc":"2026-07-23T20:02:38Z","skill_id":"dft-project-orchestrator","skill_version":"1.0","tool_id":"official-document-pack-builder","tool_version":"1.0"},"review_expires_utc":null,"reviewer":{"reviewed_utc":"2026-07-23T20:02:38Z","reviewer_id":"official-document-pack-builder","role":"license-reviewer"},"schema_version":"1.0","status":"partial","storage_rules":[{"allowed_storage_modes":["excluded","metadata-only"],"artifact_kind":"metadata","assessment":"unresolved","attribution_required":"unknown","conditions":["Keep official body content external; retain only exact identities, selectors, and receipts in this pack."],"license_evidence_refs":["repository-contracts-orchestrator-license-evidence"],"limitations":["No root repository license was found; exact revision identity does not grant redistribution rights.","The exact official-terms bytes, retrieval revision, reviewer, and obligation analysis are not platform attested.","The generated review is the conservative intersection of the central authority policy and the hashed provider catalog."],"modified_content_marking_required":"unknown","notice_required":"unknown","rights_holder":"Official provider; exact rights-holder scope remains subject to the cited official terms.","share_alike_required":"unknown","source_material_class":"documentation-text","source_offer_required":"unknown"}],"supersedes_review_ids":[],"trust_attestation":{"attestation_ref":null,"registry_path":"registry/official-document-consumers.yaml","registry_sha256":"60bf8d0f3d9596eeac1d9541d5f819d549ac937ab5a6fa5c316f6413d939a99c","trust_id":null,"trust_mode":"unverified"}}
